{
  "$schema": "https://json-schema.org/draft/2020-12/schema",
  "$id": "https://skainet.ai/schemas/operator-doc/v1",
  "title": "SKaiNET Operator Documentation Schema",
  "description": "JSON schema for SKaiNET operator documentation generated by KSP processor",
  "type": "object",
  "properties": {
    "schema": {
      "type": "string",
      "format": "uri",
      "description": "Schema URI identifier",
      "const": "https://skainet.ai/schemas/operator-doc/v1"
    },
    "version": {
      "type": "string",
      "pattern": "^\\d+\\.\\d+\\.\\d+(-[a-zA-Z0-9.-]+)?$",
      "description": "Semantic version of the framework"
    },
    "commit": {
      "type": "string",
      "pattern": "^[a-f0-9]{7,40}$|^unknown$",
      "description": "Git commit SHA or 'unknown'"
    },
    "timestamp": {
      "type": "string",
      "format": "date-time",
      "description": "ISO 8601 timestamp when documentation was generated"
    },
    "module": {
      "type": "string",
      "minLength": 1,
      "description": "Name of the module containing the operators"
    },
    "operators": {
      "type": "array",
      "items": {
        "$ref": "#/$defs/OperatorDoc"
      },
      "description": "Array of operator documentation objects"
    }
  },
  "required": ["schema", "version", "commit", "timestamp", "module", "operators"],
  "additionalProperties": false,
  "$defs": {
    "OperatorDoc": {
      "type": "object",
      "properties": {
        "name": {
          "type": "string",
          "minLength": 1,
          "description": "Name of the operator class"
        },
        "packageName": {
          "type": "string",
          "pattern": "^[a-z][a-z0-9_]*(\\.[a-z][a-z0-9_]*)*$",
          "description": "Fully qualified package name"
        },
        "modality": {
          "type": "string",
          "enum": ["core", "vision", "nlp", "audio"],
          "description": "Modality category of the operator"
        },
        "functions": {
          "type": "array",
          "items": {
            "$ref": "#/$defs/FunctionDoc"
          },
          "description": "Array of function documentation objects"
        }
      },
      "required": ["name", "packageName", "modality", "functions"],
      "additionalProperties": false
    },
    "FunctionDoc": {
      "type": "object",
      "properties": {
        "name": {
          "type": "string",
          "minLength": 1,
          "description": "Name of the function"
        },
        "signature": {
          "type": "string",
          "minLength": 1,
          "description": "Full function signature string"
        },
        "parameters": {
          "type": "array",
          "items": {
            "$ref": "#/$defs/ParameterDoc"
          },
          "description": "Array of parameter documentation objects"
        },
        "returnType": {
          "type": "string",
          "minLength": 1,
          "description": "Return type of the function"
        },
        "statusByBackend": {
          "type": "object",
          "patternProperties": {
            "^[a-zA-Z][a-zA-Z0-9_]*$": {
              "type": "string",
              "enum": ["implemented", "not_implemented", "in_progress"],
              "description": "Implementation status for this backend"
            }
          },
          "additionalProperties": false,
          "description": "Map of backend names to implementation status"
        },
        "notes": {
          "type": "array",
          "items": {
            "$ref": "#/$defs/Note"
          },
          "description": "Array of notes associated with the function"
        }
      },
      "required": ["name", "signature", "parameters", "returnType", "statusByBackend", "notes"],
      "additionalProperties": false
    },
    "ParameterDoc": {
      "type": "object",
      "properties": {
        "name": {
          "type": "string",
          "minLength": 1,
          "description": "Name of the parameter"
        },
        "type": {
          "type": "string",
          "minLength": 1,
          "description": "Type of the parameter"
        },
        "description": {
          "type": "string",
          "description": "Optional description of the parameter"
        }
      },
      "required": ["name", "type"],
      "additionalProperties": false
    },
    "Note": {
      "type": "object",
      "properties": {
        "type": {
          "type": "string",
          "enum": ["owner", "issue"],
          "description": "Type of the note"
        },
        "backend": {
          "type": "string",
          "pattern": "^[a-zA-Z][a-zA-Z0-9_]*$",
          "description": "Backend this note applies to"
        },
        "content": {
          "type": "string",
          "minLength": 1,
          "description": "Content of the note"
        }
      },
      "required": ["type", "backend", "content"],
      "additionalProperties": false
    }
  }
}
