{
  "schema": "https://skainet.ai/schemas/operator-doc/v1",
  "version": "1.0.0",
  "commit": "abc123def",
  "timestamp": "2025-10-22T23:30:00Z",
  "module": "skainet-lang-core",
  "operators": [
    {
      "name": "TensorOps",
      "packageName": "sk.ainet.lang.tensor.ops",
      "modality": "core",
      "functions": [
        {
          "name": "matmul",
          "signature": "fun matmul(a: Tensor, b: Tensor): Tensor",
          "parameters": [
            {
              "name": "a",
              "type": "Tensor",
              "description": "First tensor for matrix multiplication"
            },
            {
              "name": "b",
              "type": "Tensor",
              "description": "Second tensor for matrix multiplication"
            }
          ],
          "returnType": "Tensor",
          "statusByBackend": {
            "cpu": "implemented",
            "gpu": "in_progress",
            "tpu": "not_implemented"
          },
          "notes": [
            {
              "type": "owner",
              "backend": "gpu",
              "content": "john.doe"
            },
            {
              "type": "issue",
              "backend": "tpu",
              "content": "#123"
            }
          ]
        },
        {
          "name": "add",
          "signature": "fun add(a: Tensor, b: Tensor): Tensor",
          "parameters": [
            {
              "name": "a",
              "type": "Tensor",
              "description": "First tensor"
            },
            {
              "name": "b",
              "type": "Tensor",
              "description": "Second tensor"
            }
          ],
          "returnType": "Tensor",
          "statusByBackend": {
            "cpu": "implemented",
            "gpu": "implemented",
            "tpu": "implemented"
          },
          "notes": []
        }
      ]
    }
  ]
}